round,title,src,description,description_wc,thumbnail,redirect,Year
0,Novacene: The Coming Age of Hyperintelligence,James Lovelock,"James Lovelock, the visionary scientist and creator of the Gaia hypothesis, explores the potential rise of a new geological age shaped by advanced artificial intelligence. Lovelock envisions a future in which the rapid evolution of AI and computing power leads to a technological singularity, giving birth to superintelligent entities that far surpass human capabilities. He examines the profound implications of this transition, speculating on how hyperintelligent systems might transform the Earth and extend their influence into the cosmos. Drawing from diverse scientific fields such as computer science, neuroscience, physics, and evolutionary biology, Lovelock delves into the nature of intelligence, the limitations of human cognition, and the ethical considerations surrounding the creation of superintelligent beings. With a career spanning decades of groundbreaking research in Earth system science, Lovelock brings a unique perspective to the discussion of AI and its potential impact on the future of life on Earth. ""Novacene"" offers a thought-provoking and intellectually stimulating exploration of the possibilities and challenges that lie ahead as humanity stands on the brink of a new era defined by the emergence of hyperintelligence.",178,./thumbnail/novacene.jpg,https://arena-attachments.s3.amazonaws.com/25954911/7e332580918c8c2a25d19a4d9c1aae7e.pdf?1706300739,2019
0,Notes on the Synthesis of Form,Christopher Alexander,"Christopher Alexander, an influential architect and design theorist, presents a groundbreaking approach to the design process in his seminal work ""Notes on the Synthesis of Form."" Published in 1964, the book introduces a systematic method for tackling complex design problems by breaking them down into smaller, more manageable sub-problems and synthesizing solutions through iterative refinement. Alexander draws upon concepts from various fields, including mathematics, physics, and psychology, to develop a rigorous framework for understanding the context and requirements of a problem before attempting to solve it. The book explores crucial topics such as hierarchies, decomposition, formal languages, and the role of diagrams in design, offering insights that extend beyond the realm of architecture. With a background in architecture, mathematics, and computer science, Alexander brings a unique perspective to design methodology. ""Notes on the Synthesis of Form"" has had a profound impact on fields like computer science, software engineering, and systems theory, cementing its status as a seminal work in design theory. Alexander's ideas continue to shape the way designers approach complex problems and strive for elegant, context-sensitive solutions.",177,./thumbnail/alexander-form.jpg,https://monoskop.org/images/f/ff/Alexander_Christopher_Notes_on_the_Synthesis_of_Form.pdf,1964
0,Bioregionalism,Peter Berg,"An insightful essay by Peter Berg exploring the concept of bioregionalism as a means to harmonize human activities with the natural systems and characteristics of distinct geographic regions, termed ""life-places"" or bioregions. Berg was a renowned writer, activist and pioneer of the bioregional movement.

The essay argues that conservation efforts and environmentalism alone are insufficient to halt and reverse the catastrophic effects of human activities on the biosphere since the industrial era. Instead, a fundamental transformation of consciousness is required, centered around the practice of ""reinhabitation"" – the active process of rejoining human beings into the overall web of life within their local bioregion.

It defines a bioregion as a continuous geographic terrain with a unique pattern of natural features, including climate, landforms, watersheds, soils, and native flora and fauna. Berg advocates for three main bioregional goals: restoring and maintaining local natural systems, practicing sustainable ways to meet basic needs, and supporting reinhabitation through projects, jobs, education and activism.

The bioregional movement Berg helped catalyze in the 1970s has gained influence across disciplines like ecology, planning, farming and art. Bioregionalists prioritize local collaborations to address sustainability, often pushing for changes aligned with ecological rather than political boundaries. The essay positions bioregionalism as vital for redirecting human activities toward coexistence with the life-places they inhabit.",210,./thumbnail/bioregionalism.jpg,https://planetdrum.org/bioregionalism-an-introduction/,2009
0,Philip Beesley Studio,Philip Beesley,"Philip Beesley is a pioneering architect and artist whose interdisciplinary Toronto-based studio creates innovative architectural installations and public artworks. Beesley's work pushes the boundaries of responsive architecture through his groundbreaking research into immersive, interactive environments featuring lightweight tensile structures integrated with distributed sensors, actuators, and control systems.

His studio's singular creative process combines digital fabrication techniques like 3D printing with traditional craftsmanship to produce intricate geometric sculptures and building components. Beesley's environments are brought to life through embedded kinetic mechanisms, sound, and illumination elements that react to occupants, blurring the line between architecture and artificial life.

At the core of Beesley's practice is a focus on developing new responsive envelope systems and material assemblies that can sense and adapt to their surroundings. His work explores bio-inspired design principles, drawing from fields like synthetic biology, motion physics, mechatronics, and digital morphogenesis.

Through experimentation across disciplines and scales ranging from urban interventions to wearable artifacts, Beesley continually reimagines the possible relationships between the built environment, technology, and the natural world. His pioneering creations offer a unique vision for a future architecture that is dynamic, reactive and seamlessly integrated with the living systems it inhabits.",188,./thumbnail/philip-beesley.jpg,https://www.philipbeesleystudioinc.com/publications/,2019
0,Compass: Charting the Evolution of Outdoor Gear,Warren McLaren,"""Compass"" is a personal passion project chronicling the innovative history of equipment and clothing within the outdoor pursuits industry. While not a definitive account, it provides an idiosyncratic and curated recollection through a rich collection of images, product information, and company histories.

The website features a comprehensive history timeline tracking significant events, company formations, and product releases across the entire outdoor gear sector. Brand backgrounders offer in-depth profiles on individual companies, their specific histories, and a trove of vintage photographs and catalog images from the pre-internet era.

As physical catalogs and product documentation become increasingly ephemeral in the digital age, ""Compass"" serves as an archive preserving this visual legacy. The website aims to salvage and memorialize product histories that would otherwise be lost as companies continuously refresh their online presence.

While thoroughly researched, the site embraces its amateur nature and personal curation, acknowledging potential mistakes and omissions. It provides an alternative vantage point into the evolution of outdoor equipment through the lens of one hobbyist's obsessive collection and documentation efforts.",166,./thumbnail/compass-outdoor.jpg,http://www.outdoorinov8.com/compass/compassbrands.html,2015
0,Bob Gillis Shelter Systems,Bob Gillis,"Bob Gillis is a pioneering inventor renowned for his groundbreaking contributions to tent design and emergency shelter solutions. In the 1970s, Gillis revolutionized camping with the creation of the first geodesic dome tent. This radically new design utilized slender arching poles and less fabric, resulting in tents that were lightweight, cost-effective, exceptionally sturdy, and highly stable in windy conditions.

Gillis's dome tents went on to become the industry standard, with their core design elements adopted by virtually all modern backpacking tents over 40 years later. In the 1990s, he solved another long-standing issue - leakage and interior condensation - by inventing a novel ""Grip Clips"" system that connects panels without sewing or puncturing the fabric.

Beyond recreational camping, Gillis's tents have proven invaluable for international relief efforts over the past two decades. Their unique blend of spaciousness, affordability, portability and resilience in harsh conditions has provided vital emergency shelter to thousands of disaster victims worldwide.

Gillis's pioneering work has transformed tent design through ingenious concepts that increase liveability while reducing weight, cost and environmental impact. His creations reflect an enduring commitment to innovative engineering solutions that enhance people's experiences in the outdoors and in crisis situations.",192,./thumbnail/bob-gillis.jpg,https://shelter-systems.com/about-shelter-systems/bob-gillis/,
0,Steps to an Ecology of Mind,Gregory Bateson,"""Steps to an Ecology of Mind"" is an influential collection of essays and short works by the polymath Gregory Bateson, spanning topics across anthropology, cybernetics, psychiatry, and epistemology. Originally published in 1972, it provides a window into Bateson's wide-ranging and unconventional thinking over his prolific career.

The book leads with a series of conversational ""metalogues"" between Bateson and his daughter, using dialectic discourse to explore concepts like instinct, learning, and the nature of conceptual boundaries. Subsequent sections delve into his anthropological fieldwork and writings on cultural patterns, drawing insights from his study of indigenous societies.

Bateson then examines pathologies of human relationships through a cybernetic lens, proposing influential theories on the root causes of schizophrenia, alcoholism, and dysfunctional family dynamics. He expounds on biological and evolutionary themes like cetacean communication and coding mechanisms in nature.

The concluding sections wrestle with epistemological questions and the flaws in humanity's entrenched patterns of thinking that enabled an escalating ecological crisis. Bateson advocates for increased cognitive ""flexibility"" and revamped epistemological premises to navigate complex systemic challenges.

With foresight into many issues facing the modern world, this seminal work showcases Bateson's pioneering transdisciplinary synthesis and still resonates with those grappling with the interdependencies between mind, nature and civilization.",198,./thumbnail/ecology-of-mind.jpg,https://ejcj.orfaleacenter.ucsb.edu/wp-content/uploads/2017/06/1972.-Gregory-Bateson-Steps-to-an-Ecology-of-Mind.pdf,1972
0,How Fire Can Restore a Forest,The Nature Conservancy,"This time-lapse project offers a captivating look at the rejuvenating effects of prescribed burning on longleaf pine habitat. Longleaf pine forests are among the most biodiverse ecosystems in North America, but have been threatened by decades of fire suppression policies that disrupt their natural cycle.

Longleaf pines are a fire-adapted species that depend on periodic surface fires to remove understory vegetation and allow seedlings to establish. These low-intensity, controlled burns play a vital role in maintaining the open forest structure, stimulating seed release, and creating conditions that sustain the rich diversity of plant and animal life.

Without fire, longleaf stands become overcrowded and susceptible to diseases, insects and wildfires. Encroaching hardwoods and shrubs outcompete longleaf seedlings for sunlight. The forest floor accumulates thick duff layers that breed pests and make germination difficult.

By capturing the stunning regrowth after a reintroduced prescribed burn, this time-lapse vividly demonstrates the rejuvenating power of fire as an ecological disturbance. The emerging wildflowers, grasses, and longleaf seedlings reveal the resilience of this threatened ecosystem when its natural fire regime is restored.

Beyond their beauty, these images elevate awareness of longleaf pine conservation and the prescribed burning practices critical to sustaining North America's rich ecological heritage. The footage stands as a tribute to fire's capacity to spark renewal in fire-adapted habitats.",210,./thumbnail/controlled-burn.jpg,https://www.youtube.com/watch?v=cMUnFyz_8mM,2013
0,Take the World From Another Point of View,Richard Feynman,"The documentary ""Take the World From Another Point of View"" offers a captivating glimpse into the brilliant yet unconventional mind of Richard Feynman, one of the 20th century's most influential and iconoclastic physicists. Feynman, renowned for his pioneering work in quantum electrodynamics and his knack for making complex ideas accessible, is captured during a 1973 visit to England with his British wife.

What sets this film apart is its inclusion of a spirited conversation between Feynman and the eminent astrophysicist Fred Hoyle. Their friendly debate covers topics at the cutting-edge of physics and cosmology of the era - the nature of gravity, the beginning of the universe, the possibility of life on other planets.

Feynman's perspective is distinctly pragmatic, entertaining alternative viewpoints while remaining deeply skeptical of theories that lack empirical evidence. His penetrating curiosity and insistence on simplicity shine through as he challenges Hoyle's speculative ideas about steady-state cosmology.

Beyond delving into heady scientific concepts, the documentary captures Feynman's infectious enthusiasm for understanding the world around him through firsthand observation and experimentation. His playful, irreverent personality and talent for making the abstract tangible provide an entertaining counterpoint to the profound subject matter.

Highlighting Feynman's unique ability to unravel nature's mysteries, this film celebrates an iconic figure whose impact spanned from laying the foundations of modern physics to inspiring generations of critical thinkers.",218,./thumbnail/feynman-pov.jpg,https://youtu.be/GNhlNSLQAFE?si=5yPqXJzql3tD0lXD,1973
0,The Power of Simplicity,Alan Kay,"This thought-provoking talk comes from Alan Kay, a pioneering computer scientist and visionary thinker who has spent decades pushing the boundaries of computing and user interfaces. Kay was one of the key researchers at Xerox PARC in the 1970s, where his team invented core concepts like the graphical user interface, object-oriented programming, and powerful personal computing prototypes that foreshadowed modern PCs and laptops.

Drawing from this formative experience at PARC as well as his deep multidisciplinary knowledge spanning biology, physics, anthropology and more, Kay argues that corporations are too mired in near-term, incremental thinking to achieve true breakthroughs. He calls for embracing simplicity by rethinking first principles and system architectures from the ground up, rather than perpetually layering complexity on top of aging foundations.

Kay illustrates how the most significant innovations of the past arose from redefining core building blocks and shedding outdated constraints, from the planetary model to the first personal computers. He advocates long-term ""blue sky"" research over 5-10 year timelines to develop transformative technologies unconstrained by the current reality.

The talk challenges familiar corporate mindsets like excessive problem-solving, resource misallocation, and the futility of chasing perfection or marginal ""progress."" Kay's forward-looking perspective highlights embracing uncertainty, distributing intelligence, and shaping radically better futures unrestricted by present-day thinking.",205,./thumbnail/kay-simplicity.jpg,https://youtu.be/NdSD07U5uBs?si=CwaA_DxzZR7EDSWh,2015
0,Analogy as the Core of Cognition,Douglas Hofstadter,"Douglas Hofstadter, a renowned scholar in the fields of cognitive science, philosophy, and analogy-making, presents a provocative perspective on the foundational role of analogy in human thought processes. Challenging the conventional view of analogy as a specialized reasoning tool, Hofstadter posits that the act of forming analogies unconsciously underlies and drives all conceptual thought from childhood onwards.

In this seminal talk, he argues that every concept we grasp, whether explicitly named or unlabeled, emerges from a vast tapestry of unconscious analogies woven throughout our developmental years. Hofstadter sees analogy not as a form of logic or reasoning, but as the core mechanism propelling the sequential flow of human thought itself across multiple levels of abstraction.

Drawing from a rich array of examples, he builds a compelling case that analogy is not a rarified capability, but the fundamental cognitive faculty enabling us to construct an entire conceptual repertoire and navigate the world. Hofstadter's radical reframing casts analogy as the ubiquitous driving force of the mind, perpetually forging connections and patterns to make sense of our experiences.",172,./thumbnail/hofstadter-analogy.jpg,https://youtu.be/n8m7lFQ3njk?si=IJJlJPhqpH77-Tdl,2005
0,Computer Scientist as Toolsmith II,Fred Brooks,"In his influential essay ""Computer Scientist as Toolsmith II"", computing pioneer Fred Brooks explores the evolving significance of toolsmithing - the art of creating tools to enhance productivity and creativity in software engineering. Brooks, the father of the seminal book ""The Mythical Man-Month"", argues that computer scientists must see themselves not just as developers, but as toolsmiths crafting the instruments that power the software creation process.

The essay traces the progression of toolsmithing from the early days of computing to the present, examining how cutting-edge tools have continually reshaped the capabilities and working methods of programmers. Brooks champions the notion of ""leveraged thinking"" - harnessing tools to amplify developers' cognitive powers for higher-level problem-solving rather than tedious tasks.

He extolls the virtues of well-designed tools providing clean abstractions that hide complexity, allowing coders to operate at higher conceptual levels. Brooks advocates for modular toolkits with clear interfaces enabling seamless integration into larger toolchains for flexibility and collaborative workflows.

Throughout, he stresses the imperative for intuitive, efficient tools adaptable to evolving technologies and processes. The essay solidifies Brooks' vision for computer scientists as masters of their toolset - craftspeople perpetually rethinking and redefining the instruments shaping the discipline's future possibilities.",195,./thumbnail/cs-toolsmith.jpg,https://www.cs.unc.edu/~brooks/Toolsmith-CACM.pdf,1996
0,Computers and Creativity,Molly Mielke,"Molly Mielke, a researcher and writer with a background in human-computer interaction and digital creativity, delves into the symbiotic relationship between computers and human innovation in her essay ""Computers and Creativity."" Mielke posits that the true value of digital creative tools lies in their ability to amplify and actualize human creative potential. She emphasizes the importance of designing these tools to be interoperable, moldable, efficient, and community-driven, enabling users to seamlessly translate ideas into digital reality and collaborate on a global scale. Drawing on the insights of visionaries like Richard Hamming and Douglas Engelbart, Mielke highlights the profound interconnectedness between technological advancement and human creativity. She argues that by pushing digital creative tools to their full potential as co-creators with humans, we can unlock new frontiers of innovation and reshape the creative landscape. Mielke's essay serves as a thought-provoking exploration of how optimizing the design and use of digital creative tools can catalyze unprecedented levels of human ingenuity and drive transformative progress across fields.",163,./thumbnail/mm-cc.jpg,https://www.mollymielke.com/cc,2021
0,How Buildings Learn,Stewart Brand,"""How Buildings Learn"" is a groundbreaking exploration of the adaptive nature of architecture, presented and co-written by Stewart Brand. This seminal BBC TV series, directed by James Muncie and featuring music by Brian Eno, originally aired in 1997. Based on Brand's 1994 book of the same name, the series delves into the fascinating concept of what happens to buildings after they're constructed. Brand's work challenges conventional notions of static architecture by revealing how buildings evolve and adapt over time to meet the changing needs of their occupants. With insightful commentary and engaging visuals, the series examines the interplay between design, usage, and environment, shedding light on the dynamic relationship between buildings and their inhabitants. ""How Buildings Learn"" continues to resonate today, remaining a relevant resource in architectural discourse and even finding application in fields such as system and software design. Brand's perspective offers valuable insights not only to architects but also to anyone interested in the symbiotic relationship between human behavior and the built environment.",164,./thumbnail/how-buildings-learn.jpg,https://youtu.be/09pekAKuXjc?si=Lk4zdqlBRQOBCin4,1997
0,The Zooms: Extracting Zooming Shots From 600 hours of Police Helicopter Surveillance Footage,Sam Lavigne,"Sam Lavigne's blog post delves into the unsettling implications of police surveillance footage, particularly focusing on the act of zooming within the footage. Lavigne describes his experience analyzing 600 hours of leaked police aerial surveillance footage, highlighting the disconcerting level of detail captured by the cameras and the sci-fi-inspired interface overlay. Through his script, Lavigne attempts to filter the aimless footage to moments of interest, only to find that most zooming shots lack significant content. He reflects on how the fictional portrayal of police surveillance in media has influenced real-world surveillance practices, prompting broader questions about the role and self-perception of law enforcement.

Furthermore, Lavigne's analysis underscores the deceptive nature of surveillance footage, which often serves to perpetuate narratives of omnipresent danger and the necessity of policing. This manufactured narrative not only justifies the existence of law enforcement agencies but also fosters a culture of fear and compliance among the public. Lavigne's exploration serves as a critical examination of the intersection between technology, surveillance, and societal perceptions of authority, shedding light on the insidious ways in which surveillance imagery shapes public discourse and perpetuates power imbalances.",184,./thumbnail/surveillance-zooms.jpg,https://lav.io/notes/the-zooms/,2022
0,Life After Lifestyle,Toby Shorin,"Toby Shorin's compelling essay, ""Life After Lifestyle,"" offers a profound reflection on the evolution of marketing and culture over the past decade. With six years of meticulous research and observation, Shorin provides a penetrating analysis of the shift from the era of ""Lifestyle"" to a new paradigm where brands actively manufacture and shape culture. Shorin argues that the previous era was characterized by brands attaching themselves to existing cultural contexts, whereas the emerging trend sees culture itself becoming the product, with brands playing a secondary role. This transformation has led to the proliferation of novel subcultures and raises questions about the future trajectory of consumerism and societal values.

Notably, Shorin contemplates the implications of brands evolving into synthetic religions, fostering a transition from consumers to adherents. The essay has garnered praise from influential figures, indicating its significance in contemporary discourse on marketing and culture. Shorin advocates for the cultivation of strong ethical cultures to counteract the influence of synthetic brand cultures and emphasizes the importance of supporting brands aligned with inclusive and beneficial strategies. ""Life After Lifestyle"" offers a thought-provoking perspective on the intersection of commerce, culture, and human values in the digital age.",192,./thumbnail/life-after-lifestyle.jpg,https://subpixel.space/entries/life-after-lifestyle/,2022
